<?xml version="1.0" encoding="UTF-8"?>
<xs:schema xmlns:xs="http://www.w3.org/2001/XMLSchema" xmlns="https://pratyushguptachrist.github.io/Playtopia/" targetNamespace="https://pratyushguptachrist.github.io/Playtopia/" elementFormDefault="qualified">

  <xs:element name="games">
    <xs:complexType>
      <xs:sequence>
        <xs:element name="game" maxOccurs="unbounded">
          <xs:complexType>
            <xs:sequence>
              <xs:element name="name" type="xs:string"/>
              <xs:element name="image" type="xs:string"/>
              <xs:element name="link" type="xs:anyURI"/>
            </xs:sequence>
          </xs:complexType>
        </xs:element>
      </xs:sequence>
    </xs:complexType>
  </xs:element>

</xs:schema>
